title,abstract,doi,source,original_search_retrieved,original_full_text_retrieved,seed_doi,seed_pmid,included_doi,included_pmid,,,,,
Optimization of home care nurses in Canada: A scoping review.,"Nurses are among the largest providers of home care services thus optimisation of this workforce can positively influence client outcomes. This scoping review maps existing Canadian literature on factors influencing the optimisation of home care nurses (HCNs). Arskey and O'Malley's five stages for scoping literature reviews were followed. Populations of interest included Registered Nurses, Registered/Licensed Practical Nurses, Registered Nursing Assistants, Advanced Practice Nurses, Nurse Practitioners and Clinical Nurse Specialists. Interventions included any nurse(s), organisational and system interventions focused on optimising home care nursing. Papers were included if published between January 1, 2002 up to May 15, 2015. The review included 127 papers, including 94 studies, 16 descriptive papers, 6 position papers, 4 discussion papers, 3 policy papers, 2 literature reviews and 2 other. Optimisation factors were categorised under seven domains: Continuity of Care/Care; Staffing Mix and Staffing Levels; Professional Development; Quality Practice Environments; Intra-professional and Inter-professional and Inter-sectoral Collaboration; Enhancing Scope of Practice: and, Appropriate Use of Technology. Fragmentation and underfunding of the home care sector and resultant service cuts negatively impact optimisation. Given the fiscal climate, optimising the existing workforce is essential to support effective and efficient care delivery models. Many factors are inter-related and have synergistic impacts (e.g., recruitment and retention, compensation and benefits, professional development supports, staffing mix and levels, workload management and the use of technology). Quality practice environments facilitate optimal practice by maximixing human resources and supporting workforce stability. Role clarity and leadership supports foster more effective interprofessional team functioning that leverages expertise and enhances patient outcomes. Results inform employers, policy makers and relevant associations regarding barriers and enablers that influence the optimisation of home care nursing in nursing, intra- and inter-professional and inter-organisational contexts.",10.1111/hsc.12797,PubMed,,,,,,,,,,,
Recommendations to conduct and report systematic reviews in medical literature: a scoping review.,"BACKGROUND: This scoping review aims to identify, review and characterize the published recommendations to conduct and/or to report a systematic review in medical interventions area. METHODS: A search was carried out in PubMed, EMBASE and Cochrane Library databases, using systematic reviews search filters. The search comprises all recommendations to conduct and/or report a systematic review. Data on methods were extracted from each recommendation. A descriptive analysis was performed. RESULTS: Eighty-three recommendations were identified. Approximately 60% of retrieved references were published in the last 6 years. Recommendations to both conduct and report a systematic review were issued in 47% studies. The guidance presented in each recommendation to conduct and/ or report a systematic review varied. Almost 96% of the recommendations offer guidance on systematic review methods section. The need and time for updating was only recommended in 29% of recommendations. Forty percent of recommendations endorsed their methods to any subject related to medical interventions. Half of the studies did not specify the design of studies to be included in a systematic review. CONCLUSIONS: Several recommendations to conduct and/or report a systematic review were published and offered different guidance. Further research on the impact of such heterogeneity can improve systematic reviews quality.",10.1186/s12874-019-0870-1,PubMed,,,,,,,,,,,
Scientific Data Citation: Scoping Review,"Objective: This paper investigates the meaning assigned to data citation in order to follow the evolution of studies related to data citation, it tries to answer: 1) What are the motivations of researchers to cite scientific data?; 2) What are the data citation practices presented by the areas covered by this study?; 3) What are the metric analysis for data citation? Methods: It is a qualitative and descriptive research, being a scoping review of literature, by searching the Emerald, LISA, LIST, Scopus and Web of Science databases. Results: The studies investigated the correlation of citations increment to traditional publications by citing the data that supported them, many studies confirmed the correlation, others did not, and a common cause hypothesis arose: research quality associated with more resources. As for practices, the community is aware that current citations to data are not standardized, and there is a tendency to adopt a citation standard that meets the demands of different types of data. This lack of standard hinders the metric analysis of citation to scientific data that still needs to be explored in research, given that there is a repetition in using the same techniques of traditional citation for this new source of information. Conclusions: Promoting the progress of science is the main advantage in making data available, but there are credit and technical difficulties that need to be tackled together by researchers, institutions, funding agencies, data repositories, and publishing editorial teams.",10.5007/1518-2924.2020.e72153,WOS,,,,,,,,,,,
Grit in sport: a scoping review,"Understanding the personality characteristics that help and/or hinder competitive success in sport is of great interest to many sport psychology researchers. Grit (i.e. passion and perseverance towards long-term goals) is one such construct that has recently gained popularity in the sport domain. This scoping review explored the associations between grit and the cognitive, affective, and behavioural variables that reside within athletes and sport settings. Ninety publications were identified through various search strategies. The majority of studies explored relationships between grit and athlete sex, athlete skill/competitive level, sport performance, motivation, mindfulness, self-compassion, and deliberate practice. Constructs that have been previously critiqued as sharing significant variance with grit were also collated from the existing research. Six collegiate-level coaches were consulted as knowledgeable stakeholders and provided input to the results of the scoping review. These results allowed for the identification of future research considerations, including ameliorating current issues regarding grit measurement in sport contexts, and the designing and testing of interventions aimed at increasing athlete grit levels. Additional research with stronger methodological design and rigour is needed, and recommendations to enhance the quality of future studies with athletes are discussed.",10.1080/1750984X.2021.1934887,WOS,,,,,,,,,,,
A Scoping Review of Flow Research,"Flow is a gratifying state of deep involvement and absorption that individuals report when facing a challenging activity and they perceive adequate abilities to cope with it (EFRN, 2014). The flow concept was introduced by Csikszentmihalyi in 1975, and interest in flow research is growing. However, to our best knowledge, no scoping review exists that takes a systematic look at studies on flow which were published between the years 2000 and 2016. Overall, 252 studies have been included in this review. Our review (1) provides a framework to cluster flow research, (2) gives a systematic overview about existing studies and their findings, and (3) provides an overview about implications for future research. The provided framework consists of three levels of flow research. In the first ""Individual "" level are the categories for personality, motivation, physiology, emotion, cognition, and behavior. The second ""Contextual "" level contains the categories for contextual and interindividual factors and the third ""Cultural "" level contains cultural factors that relate to flow. Using our framework, we systematically present the findings for each category. While flow research has made progress in understanding flow, in the future, more experimental and longitudinal studies are needed to gain deeper insights into the causal structure of flow and its antecedents and consequences.",10.3389/fpsyg.2022.815665,WOS,,,,,,,,,,,
Office concepts: A scoping review,"Office concepts influence employees' work experience and performance, as well as the profitability of organisations. This study used a scoping review approach to map the field of empirical research on office concepts, identify research gaps, provide recommendations for future research, and inform practice. Systematic searches across three databases identified a total of 257 empirical studies on office concepts. Study selection and data charting were performed independently by two reviewers using standardized forms, with disagreements resolved through discussion. General and methodological characteristics of the included studies were mapped. For studies comparing different office concepts, the degree of focus on spatial design and change processes were also mapped. The findings establish that this is a strongly interdisciplinary field, with increasing publication numbers in recent years. The included studies are heterogeneous, using a variety of study designs and outcome variables, and focus on various aspects of the office environment. Studies comparing different office concepts tend to not focus on spatial design or change processes. This lack might cause these areas to come across as less important than they are, and has implications for practical decision-making regarding workplace design. We recommend that future research efforts focus on conducting randomized controlled trials in real-world office settings. Further research gaps can be identified using the tables and figures included.",10.1016/j.buildenv.2019.106294,WOS,,,,,,,,,,,
Community-based surveillance: A scoping review,"Background Involving community members in identifying and reporting health events for public health surveillance purposes, an approach commonly described as community-based surveillance (CBS), is increasingly gaining interest. We conducted a scoping review to list terms and definitions used to characterize CBS, to identify and summarize available guidance and recommendations, and to map information on past and existing in-country CBS systems. Methods We searched eight bibliographic databases and screened the worldwide web for any document mentioning an approach in which community members both collected and reported information on health events from their community for public health surveillance. Two independent reviewers performed double blind screening and data collection, any discrepancy was solved through discussion and consensus. Findings From the 134 included documents, several terms and definitions for CBS were retrieved. Guidance and recommendations for CBS were scattered through seven major guides and sixteen additional documents. Seventy-nine unique CBS systems implemented since 1958 in 42 countries were identified, mostly implemented in low and lower-middle income countries (79%). The systems appeared as fragmented (81% covering a limited geographical area and 70% solely implemented in a rural setting), vertical (67% with a single scope of interest), and of limited duration (median of 6 years for ongoing systems and 2 years for ended systems). Collection of information was mostly performed by recruited community members (80%). Interpretation While CBS has already been implemented in many countries, standardization is still required on the term and processes to be used. Further research is needed to ensure CBS integrates effectively into the overall public health surveillance system.",10.1371/journal.pone.0215278,WOS,,,,,,,,,,,
Altruism in Paramedicine: A Scoping Review,"While altruism has been studied in healthcare professions such as nursing and medicine, the exploration of the characteristics of altruism, as related to paramedicine and emergency care in Australia, is limited. This scoping review explores altruism in paramedicine from the perspective of the paramedic as practitioner, learner, and educator as seen through the lens of the paramedic and the patient. Also discussed is the positive impact of altruism on the patient experience of care. A scoping review was used to assess the availability of data related to altruism in paramedicine. The Preferred Reporting Items for Systematic Reviews and Meta-Analyses extension for Scoping Reviews was used to guide the process. Search categories were orientated around the subject (altruism) and discipline (paramedicine). A total of 27 articles are included in this scoping review. Initial searching identified 742 articles; after duplicate removal, 396 articles were screened with 346 excluded. Fifty articles were full-text reviewed and 23 excluded. The final 27 were extracted following full-text screening. None of the articles are specific to altruism in paramedicine. The data related to the practice of altruism in paramedicine are extremely limited. The preponderance of data arise from Europe and North America which, due to crewing and service differences, may impact the practice of altruism in different regions. Recent changes to the scope of paramedic practice, workload, education, and case acuity may influence behaviour regarding altruism, compassion, caring, and associated caring behaviours. The practice and education of paramedics including altruism, compassion, caring and caring behaviours in the Australasian setting warrants further research.",10.3390/healthcare10091731,WOS,,,,,,,,,,,
Coaching special Olympics: A scoping review,"Background Special Olympics enables individuals with an intellectual disability across all continents to take part in sport year-round. Through its mission, Special Olympics provides a setting for athletes that aims to foster performance, participation, and personal development. Coaches play a central role in achieving these outcomes. As such, this scoping review aims to answer the following question: What is known about Special Olympics' coach training and practices? Method Our scoping review was conducted according to Peters et al.'s (2020) guidelines. Keywords pertaining to Special Olympics, Program evaluation, and Coaches were searched in six databases to extract articles published between 1988 and October 1, 2021. Results In all, 16 studies were included in our scoping review. Of these studies, nine included information on coach training and 13 included information on coach practices. No randomized control trials were identified. Conclusions There is currently very little knowledge on Special Olympics coach training and practices. Moreover, there is no existing data to support the effectiveness of Special Olympics coaches formal training on coaches' practices nor on athletes' outcomes. There is an urgent need for research in this field.",10.1177/17479541221134338,WOS,,,,,,,,,,,
Diagnosing Overtraining Syndrome: A Scoping Review,"Context: Overtraining syndrome (OTS) is a condition characterized by a long-term performance decrement, which occurs after a persisting imbalance between training-related and nontraining-related load and recovery. Because of the lack of a gold standard diagnostic test, OTS remains a diagnosis of exclusion. Objective: To systematically review and map biomarkers and tools reported in the literature as potentially diagnostic for OTS. Data Sources: PubMed, Web of Science, and SPORTDiscus were searched from database inception to February 4, 2021, and results screened for eligibility. Backward and forward citation tracking on eligible records were used to complement results of database searching. Study Selection: Studies including athletes with a likely OTS diagnosis, as defined by the European College of Sport Science and the American College of Sports Medicine, and reporting at least 1 biomarker or tool potentially diagnostic for OTS were deemed eligible. Study Design: Scoping review following the guidelines of the Joanna Briggs Institute and PRISMA Extension for Scoping Reviews (PRISMA-ScR). Level of Evidence: Level 4. Data Extraction: Athletes' population, criteria used to diagnose OTS, potentially diagnostic biomarkers and tools, as well as miscellaneous study characteristics were extracted. Results: The search yielded 5561 results, of which 39 met the eligibility criteria. Three diagnostic scores, namely the EROS-CLINICAL, EROS-SIMPLIFIED, and EROS-COMPLETE scores (EROS = Endocrine and Metabolic Responses on Overtraining Syndrome study), were identified. Additionally, basal hormone, neurotransmitter and other metabolite levels, hormonal responses to stimuli, psychological questionnaires, exercise tests, heart rate variability, electroencephalography, immunological and redox parameters, muscle structure, and body composition were reported as potentially diagnostic for OTS. Conclusion: Specific hormones, neurotransmitters, and metabolites, as well as psychological, electrocardiographic, electroencephalographic, and immunological patterns were identified as potentially diagnostic for OTS, reflecting its multisystemic nature. As exemplified by the EROS scores, combinations of these variables may be required to diagnose OTS. These scores must now be validated in larger samples and within female athletes.",10.1177/19417381211044739,WOS,,,,,,,,,,,
Global Scope of Hospital Pharmacy Practice: A Scoping Review,"The pharmacy profession has undergone tremendous changes over the past few decades. Pharmacists' roles have expanded their boundaries to encompass more patient-centered services. However, the degree to which these roles are practised may vary. This scoping review is aimed at describing the extent and range of the professional pharmacy services offered in hospital pharmacies across different countries and the barriers underlying inappropriate or incomplete implementation of these services. Studies published in the English language between 2015 and 2019 were retrieved from the following databases: PubMed, CINAHL, Scopus, EBSCO Discovery Service, and Web of Science. A thematic analysis across the included studies produced two main themes. ""Scope of practice"" comprised three subthemes: pharmaceutical care practice, clinical pharmacy practice, and public health services and ""Multiple levels of influence"" comprised five subthemes: individual, interpersonal, institutional, community, and public policy-related factors. The hospital pharmacy services across countries ranged from traditional drug-centered pharmacy practice to a more progressive, clinically oriented practice. In some countries, there is an apparent inadequacy in the clinical pharmacy services provided compared to other clinical settings. Understanding the current pharmacy practice culture across different health care systems is an essential step towards improving the profession.",10.3390/healthcare8020143,WOS,,,,,,,,,,,
Diet and Psychosis: A Scoping Review,"Introduction: Schizophrenia spectrum disorders (SSD) represent a cluster of severe mental illnesses. Diet has been identified as a modifiable risk factor and opportunity for intervention in many physical illnesses and more recently in mental illnesses such as unipolar depression; however, no dietary guidelines exist for patients with SSD. Objective: This review sought to systematically scope the existing literature in order to identify nutritional interventions for the prevention or treatment of mental health symptoms in SSD as well as gaps and opportunities for further research. Methods: This review followed established methodological approaches for scoping reviews including an extensive a priori search strategy and duplicate screening. Because of the large volume of results, an online program (Abstrackr) was used for screening and tagging. Data were extracted based on the dietary constituents and analyzed. Results: Of 55,330 results identified by the search, 822 studies met the criteria for inclusion. Observational evidence shows a connection between the presence of psychotic disorders and poorer quality dietary patterns, higher intake of refined carbohydrates and total fat, and lower intake or levels of fibre, omega-3 and omega-6 fatty acids, vegetables, fruit, and certain vitamins and minerals (vitamin B-12 and B-6, folate, vitamin C, zinc, and selenium). Evidence illustrates a role of food allergy and sensitivity as well as microbiome composition and specific phytonutrients (such as L-theanine, sulforaphane, and resveratrol). Experimental studies have demonstrated benefit using healthy diet patterns and specific vitamins and minerals (vitamin B-12 and B-6, folate, and zinc) and amino acids (serine, lysine, glycine, and tryptophan). Discussion: Overall, these findings were consistent with many other bodies of knowledge about healthy dietary patterns. Many limitations exist related to the design of the individual studies and the ability to extrapolate the results of studies using dietary supplements to dietary interventions (food). Dietary recommendations are presented as well as recommendations for further research including more prospective observational studies and intervention studies that modify diet constituents or entire dietary patterns with statistical power to detect mental health outcomes.",10.1159/000493399,WOS,,,,,,,,,,, 
Norms in sport: a scoping review,"The influence of a 'group' is often posited as a key factor that influences behavior. This is relevant in sports, where the presence of norms develops through interactions with important others. As such, an athlete's perception of what is normative may have a significant role in how that athlete thinks and behaves. The present study undertakes a scoping review of research on norms in sports, specifically to describe the extent, scope and range of research conducted to date. Six online databases were searched to identify research published up to January 2021, from which 124 met inclusion criteria. To be included, articles were published peer-reviewed articles, written in English and evaluated norms within an athlete sample. The results suggest that the use of theoretical frameworks and conceptualizations of norms varied considerably and were used inconsistently. Most studies included in this review used a cross-sectional research design, were conducted within North America, and focused on adult athlete populations. This study identified that the concept of 'norms' has been examined extensively in sport, with an opportunity to explore norms in a wider range of samples and with advanced research methodologies to progress our understanding of norms in sport.",10.1080/1750984X.2022.2051151,WOS,,,,,,,,,,,
Fatherlessness Begins Prenatally: A Scoping Review,"Objective: Clinicians should encourage and promote paternal involvement even in prenatal care, as this early engagement has far-reaching, positive implications on a child's life. Summary: Men are not superfluous to the abortion process. In fact, a father's roles and responsibilities start before the act leading to conception and continue through the pregnancy, birth, and through their children's lives. This paper seeks to review evidence that these roles play an important part in a child's overall development. Additionally, this paper seeks to suggest direct approaches physicians may take to encourage constructive engagement and responsibility in fathers.",,WOS,,,,,,,,,,,
Echolalia in Autism: A Scoping Review,"Echolalia, a language phenomenon whereby individuals imitate the speech of others, is commonly used by children and adults with autism. Research into the underlying nature and meanings associated with this repetitive behaviour is characterised by a lack of conceptual definitions and conflicting opinions about the functions of echolalia. A scoping review was undertaken to summarise the range of perspectives on these topics and identify associated research gaps. Five databases were searched, and 28 studies met the eligibility criteria. Results showed clear groupings in the topics discussed, based around interactional intent, factors that affect the frequency and type of echolalia, language development, measurement, and functions of echolalia. The review revealed that echolalia has a number of functions for people with autism, however many interventions continue to focus on reduction or elimination of echolalia. Findings suggest that further research is required to examine possible functions of echolalia. Confirming the function of this behaviour for people with autism is likely to have direct consequences for the type of intervention deemed appropriate.",10.1080/1034912X.2022.2154324,WOS,,,,,,,,,,,
